City,BHK,Location,Price (₹),Area (sqft),Property Type,Furnishing,Property Facing,overlooking,Bathroom,Balcony,Tenant Preferred,Availability
Pune,3,"Paranjape The Highland, Paranjape The Highland, Bhugaon, Bavdhan, Pune",35000,1200 sqft,Flat,Furnished,East,"Garden/Park, Main Road",3,2,Bachelors,Immediately
Pune,2,"Magarpatta Grevillea, Magarpatta Grevillea, Magarpatta, Pune",33000,850 sqft,Flat,Semi-Furnished,East,"Garden/Park, Main Road",2,1,Bachelors/Family,Immediately
Pune,3,"Runwal The Central Park, Runwal The Central Park, Chinchwad, Pimpri Chinchwad, Pune",40000,964 sqft,Flat,Unfurnished,East,,3,3,Bachelors/Family,Immediately
Pune,3,"Pride Aashiyaana, Pride Aashiyaana, Lohegaon, Pune",31000,1350 sqft,Flat,Semi-Furnished,,,3,,Bachelors/Family,Immediately
Pune,1,"Radha Madhav Apartments, Radha Madhav Apartments, Wagholi, Pune",11000,518 sqft,Flat,Semi-Furnished,East,Main Road,1,1,Bachelors/Family,Immediately
Pune,3,"Nyati Equatorial, Nyati Equatorial, Bavdhan, Pune",50000,1850 sqft,Flat,Furnished,East,"Garden/Park, Pool, Main Road",3,3,Bachelors,Immediately
Pune,2,"Kolte Patil Umang Premiere, Kolte Patil Umang Premiere, Wagholi, Pune",24000,842 sqft,Flat,Semi-Furnished,West,"Garden/Park, Main Road",2,1,Family,Immediately
Pune,3,"G Orbit Heritage, G Orbit Heritage, Wakad, Pune",50000,900 sqft,Flat,Furnished,East,"Garden/Park, Pool, Main Road",2,3,Bachelors,Immediately
Pune,3,"Krisna Nirmaan Amorapolis, Krisna Nirmaan Amorapolis, Dhanori, Pune",31000,1008 sqft,Flat,Unfurnished,North - East,Garden/Park,3,2,Bachelors,Immediately
Pune,2,"Kolte Patil Margosa Heights, Kolte Patil Margosa Heights, NIBM Annexe Area, Pune",26000,725 sqft,Flat,Semi-Furnished,North,Main Road,2,1,Bachelors,Immediately
Pune,2,"Maniratna Complex, Maniratna Complex, Satara Road, Pune",37000,908 sqft,Flat,Semi-Furnished,East,Main Road,2,1,Bachelors,Immediately
Pune,2,"Venkatesh Graffiti, Venkatesh Graffiti, Keshav Nagar Mundhwa, Pune",38000,750 sqft,Flat,Furnished,East,"Garden/Park, Main Road",2,2,Bachelors,Immediately
Pune,2,"Kaasp Countyy, Kaasp Countyy, Wakad, Pune",34000,1050 sqft,Flat,Semi-Furnished,East,"Pool, Garden/Park, Main Road",2,1,Bachelors,Immediately
Pune,3,"NB Bhalchandra Upvan, NB Bhalchandra Upvan, Punvale Bazar, Pune",25000,860 sqft,Flat,Semi-Furnished,East,Main Road,2,3,Bachelors/Family,Immediately
Pune,2,"Kohinoor Tinsel County, Kohinoor Tinsel County, Hinjawadi, Pune",25000,640 sqft,Flat,Semi-Furnished,,,2,,Bachelors/Family,Immediately
Pune,3,"Shapoorji Pallonji Vanaha Yahavi Tower 3 Teak, Shapoorji Pallonji Vanaha Yahavi Tower 3 Teak, Bavdhan, Pune",27000,1050 sqft,Flat,Semi-Furnished,East,"Garden/Park, Pool",3,2,Bachelors,Immediately
Pune,2,"Hadapsar, Pune",12000,750 sqft,Flat,Unfurnished,,,2,2,Bachelors/Family,Immediately
Pune,2,"Kumar Palmsprings Towers, Kumar Palmsprings Towers, Undri, Pune",32000,1180 sqft,Flat,Unfurnished,North - East,"Garden/Park, Main Road",2,1,Bachelors,Immediately
Pune,1,"Raut Baug Apartment, Raut Baug Apartment, Dhankawadi, Pune",13000,555 sqft,Flat,Semi-Furnished,,,1,,Bachelors/Family,Immediately
Pune,3,"Magarpatta Riverview City Falcon Towers, Magarpatta Riverview City Falcon Towers, Loni Kalbhor, Pune",22000,1200 sqft,Flat,Semi-Furnished,North,,3,2,Bachelors/Family,Immediately
Pune,2,"Lake Tower, Lake Tower, Wagholi, Pune",21000,950 sqft,Flat,Semi-Furnished,East,Main Road,2,1,Bachelors/Family,Immediately
Pune,2,"BKP Monte Rosa, BKP Monte Rosa, Sinhgad Road, Pune",50000,950 sqft,Flat,Furnished,East,Main Road,2,2,Bachelors,Immediately
Pune,4,"Panchshil Eon Waterfront, Panchshil Eon Waterfront, EON Free Zone, Kharadi, Pune",1.4 Lac,3200 sqft,Flat,Unfurnished,East,"Garden/Park, Main Road",5,2,Bachelors/Family,Immediately
Pune,2,"Hadapsar, Pune",26000,600 sqft,Flat,Semi-Furnished,East,Main Road,2,2,Bachelors,Immediately
Pune,3,"Siddhashila Eela, Siddhashila Eela, Punawale, Pimpri Chinchwad, Pune",35000,1230 sqft,Flat,Unfurnished,East,"Garden/Park, Pool, Main Road",3,1,Bachelors,Immediately
Pune,2,Charholi BK Pune,13000,852 sqft,House,Unfurnished,East,"Garden/Park, Main Road",2,1,Bachelors/Family,Immediately
Pune,2,"Bramha SkyCity, Bramha SkyCity, Dhanori, Pune",25000,961 sqft,Flat,Semi-Furnished,,,2,,Bachelors/Family,Immediately
Pune,2,"Legacy Imperial, Legacy Imperial, Kiwale, Dehu Road, Pune",25000,794 sqft,Flat,Unfurnished,East,"Main Road, Garden/Park",2,2,Bachelors/Family,Immediately
Pune,1,"Arun Arcade, Arun Arcade, Akurdi, Pune",12000,532 sqft,Flat,Unfurnished,,"Garden/Park, Main Road",1,2,Bachelors,Immediately
Pune,3,"Pandit Javdekar Neelakunj, Pandit Javdekar Neelakunj, Kothrud, Pune",52000,1350 sqft,Flat,Unfurnished,East,Main Road,3,2,Bachelors,Immediately
Pune,2,Sukhsagar Nagar Katraj Pune,14000,700 sqft,House,Unfurnished,North - East,Main Road,1,1,Bachelors,Immediately
Pune,3,"Xrbia Hinjewadi, Xrbia Hinjewadi, Nerhe, Pune",15000,700 sqft,Flat,Semi-Furnished,East,Main Road,2,,Bachelors/Family,Immediately
Pune,1,"Newale Wasti Chikhali, Pune",10000,476 sqft,Flat,Unfurnished,East,"Garden/Park, Main Road",1,1,Bachelors,Immediately
Pune,3,"Mundhwa, Pune",50000,1085 sqft,Flat,Unfurnished,East,"Garden/Park, Pool, Main Road",3,1,Bachelors/Family,Immediately
Pune,2,"Kumar Park Infinia Phase 4 , Kumar Park Infinia Phase 4, Hadapsar, Pune",26000,850 sqft,Flat,Semi-Furnished,East,"Garden/Park, Main Road",2,1,Bachelors,Immediately
Pune,2,"Kumar Megapolis Splendour, Kumar Megapolis Splendour, Hinjawadi, Pune",38000,1000 sqft,Flat,Furnished,East,"Garden/Park, Pool, Main Road",2,1,Bachelors/Family,Immediately
Pune,1,"Kalubai Nagar Wagholi, Pune",10000,485 sqft,Flat,Unfurnished,East,Main Road,1,2,Bachelors/Family,Immediately
Pune,3,"Sentosa Ekam, Sentosa Ekam, Punawale, Pimpri Chinchwad, Pune",29000,924 sqft,Flat,Unfurnished,East,"Garden/Park, Main Road",3,3,Bachelors,Immediately
Pune,3,Wakad Pune,60000,1230 sqft,House,Unfurnished,East,Main Road,3,1,Bachelors,Immediately
Pune,2,"PS Residency , PS Residency, Charholi BK, Pune",16000,860 sqft,Flat,Unfurnished,East,Garden/Park,2,2,Bachelors/Family,Immediately
Pune,5,"Panchshil Towers, Panchshil Towers, Kharadi, Pune",2.4 Lac,3145 sqft,Flat,Furnished,East,"Garden/Park, Pool, Main Road",6,,Bachelors/Family,Immediately
Pune,3,"RajHeramba Venkatesh Imperia, RajHeramba Venkatesh Imperia, Punawale, Pimpri Chinchwad, Pune",32000,1200 sqft,Flat,Furnished,,,3,,Bachelors/Family,Immediately
Pune,2,"Venkatesh Flora, Venkatesh Flora, Mundhwa, Pune",40000,1021 sqft,Flat,Furnished,East,"Garden/Park, Main Road",2,2,Bachelors/Family,Immediately
Pune,2,Pune,25000,650 sqft,Flat,Furnished,,,1,,Bachelors/Family,Immediately
Pune,2,"G Corp Greens Center , G Corp Greens Center, Thergaon, Pimpri Chinchwad, Pune",35000,1043 sqft,Flat,Semi-Furnished,East,"Garden/Park, Pool, Main Road",2,2,Bachelors,Immediately
Pune,2,"Kohinoor Coral, Kohinoor Coral, Hinjawadi, Pune",26000,715 sqft,Flat,Semi-Furnished,East,"Garden/Park, Pool, Main Road",2,1,Bachelors,Immediately
Pune,2,"Ideal Spacio, Ideal Spacio, Undri, Pune",32000,890 sqft,Flat,Furnished,North - East,"Pool, Garden/Park",2,1,Bachelors,Immediately
Pune,2,"Adani Atelier Greens, Adani Atelier Greens, Mundhwa, Pune",55000,912 sqft,Flat,Semi-Furnished,East,"Garden/Park, Main Road",2,2,Bachelors/Family,Immediately
Pune,3,"JD Crystal, JD Crystal, Lohegaon, Pune",24500,985 sqft,Flat,Semi-Furnished,East,Main Road,2,,Bachelors/Family,Immediately
Pune,1,"Marunji Road, Pune",16000,550 sqft,Flat,Furnished,,,2,1,Bachelors/Family,Immediately
Pune,2,"Polite Panorama, Polite Panorama, Dighi, Pune",26000,860 sqft,Flat,Furnished,East,"Main Road, Garden/Park",2,3,Bachelors,Immediately
Pune,1,"Blue Ridge Town Pune, Pune",24000,496 sqft,Flat,Furnished,East,"Garden/Park, Main Road",1,2,Bachelors,Immediately
Pune,2,"Gera Song of Joy Phase 1, Gera Song of Joy Phase 1, EON Free Zone, Kharadi, Pune",45000,1150 sqft,Flat,Semi-Furnished,North - East,,2,1,Family,Immediately
Pune,1,Awhalwadi Road Pune,9000,750 sqft,House,Unfurnished,East,Garden/Park,1,3,Bachelors/Family,Immediately
Pune,1,"Koregaon Park Annexe, Mundhwa, Pune",25000,450 sqft,Flat,Semi-Furnished,East,Main Road,1,,Bachelors,Immediately
Pune,2,"Pimpri, Pune",25000,800 sqft,Flat,Unfurnished,,,2,,Bachelors/Family,Immediately
Pune,2,"Vilas Javdekar Yashwin Encore, Vilas Javdekar Yashwin Encore, Wakad, Pune",29000,850 sqft,Flat,Semi-Furnished,East,Garden/Park,2,1,Bachelors,From Feb '26
Pune,1,Kharadi Pune,20000,352 sqft,House,Semi-Furnished,North - East,,1,1,Bachelors,Immediately
Pune,1,Kharadi Pune,10000,225 sqft,House,Furnished,,,1,,Bachelors/Family,Immediately
Pune,2,"Ashtekar Silver Oak, Ashtekar Silver Oak, Katraj, Pune",25000,1040 sqft,Flat,Semi-Furnished,East,Main Road,2,2,Bachelors,Immediately
Pune,3,"Raheja Woods, Raheja Woods, Joggers Park, Pune",75000,1050 sqft,Flat,Furnished,South - East,Garden/Park,3,1,Family,From Feb '26
Pune,3,"Marvel Enigma, Marvel Enigma, Kharadi, Pune",65000,1600 sqft,Flat,Semi-Furnished,East,"Garden/Park, Pool, Main Road",3,3,Bachelors/Family,From Feb '26
Pune,2,"Rahul Downtown, Rahul Downtown, Bapu Buwaji Nagar, Pune",26000,751 sqft,Flat,Semi-Furnished,East,"Garden/Park, Pool, Main Road",2,2,Bachelors/Family,Immediately
Pune,2,"Gemini Grand Bay, Gemini Grand Bay, Manjari BK, Pune",23000,760 sqft,Flat,Semi-Furnished,East,"Pool, Garden/Park, Main Road",2,2,Bachelors,Immediately
Pune,2,"Marvel Brisa, Marvel Brisa, Balewadi, Pune",45000,1100 sqft,Flat,Semi-Furnished,West,Pool,2,2,Family,Immediately
Pune,2,"Pegasus Megapolis Serenity, Pegasus Megapolis Serenity, Hinjawadi, Pune",32000,850 sqft,Flat,Furnished,West,"Pool, Garden/Park",2,2,Bachelors,Immediately
Pune,3,"KBD Aurelia, KBD Aurelia, Baner, Pune",50000,1755 sqft,Flat,Furnished,East,"Garden/Park, Pool, Main Road",3,2,Bachelors,Immediately
Pune,1,"Mantra Insignia, Mantra Insignia, Keshav Nagar Mundhwa, Pune",25000,515 sqft,Flat,Semi-Furnished,East,"Pool, Garden/Park, Main Road",2,2,Bachelors,Immediately
Pune,2,"VTP Aethereus, VTP Aethereus, Mahalunge, Pune",25000,667 sqft,Flat,Semi-Furnished,,,2,2,Bachelors/Family,Immediately
Pune,3,"Ganga Carnation, Ganga Carnation, Koregaon Park, Pune",58000,1620 sqft,Flat,Furnished,East,"Garden/Park, Pool",3,3,Bachelors/Family,Immediately
Pune,4,"Vasant Vihar Row House, Baner Pune",1.4 Lac,3300 sqft,House,Semi-Furnished,North - East,"Garden/Park, Pool, Main Road",4,3,Bachelors,Immediately
Pune,3,"Ved Vihar Phase 3, Ved Vihar Phase 3, Bengaluru Mumbai Highway, Pune",60000,1300 sqft,Flat,Furnished,East,"Garden/Park, Pool, Main Road",3,2,Bachelors,Immediately
Pune,1,"Manisha Park, Manisha Park, Kothrud, Pune",21000,400 sqft,Flat,Furnished,,,1,1,Bachelors/Family,Immediately
Pune,3,Pune,33000,1300 sqft,Flat,Unfurnished,,,2,1,Bachelors,Immediately
Pune,2,"Dhanori Road, Pune",30000,765 sqft,Flat,Semi-Furnished,,"Main Road, Pool, Garden/Park",2,2,Bachelors/Family,Immediately
Pune,3,"Ganga Nebula, Ganga Nebula, Viman Nagar, Pune",42000,1390 sqft,Flat,Furnished,East,Garden/Park,3,1,Bachelors/Family,Immediately
Pune,1,"MHADA, MHADA, Pune",12000,500 sqft,Flat,Unfurnished,West,"Garden/Park, Pool, Main Road",1,1,Bachelors/Family,Immediately
Pune,2,"VTP Sierra, VTP Sierra, Baner Gaon, Baner, Pune",25000,611 sqft,Flat,Unfurnished,East,Main Road,2,2,Bachelors/Family,From Feb '26
Pune,2,"Manjari BK, Pune",11000,870 sqft,Flat,Unfurnished,,,2,1,Bachelors,Immediately
Pune,2,"Amrut Nagari, Amrut Nagari, Wagholi, Pune",15000,793 sqft,Flat,Semi-Furnished,East,Garden/Park,2,2,Family,Immediately
Pune,2,"Jhala Group Mahalunge Riviera, Jhala Group Mahalunge Riviera, Mhalunge Nande Road, Pune",27000,715 sqft,Flat,Unfurnished,North,Main Road,2,1,Bachelors,Immediately
Pune,2,"Fortune 108, Fortune 108, Wakad, Pune",27000,969 sqft,Flat,Semi-Furnished,East,"Garden/Park, Main Road",2,3,Bachelors,Immediately
Pune,2,"Nyati Estate, Nyati Estate, Mohammed Wadi, Pune",20000,855 sqft,Flat,Unfurnished,North - East,Garden/Park,2,2,Family,Immediately
Pune,2,"Namrata Magic, Namrata Magic, Pimple Saudagar, Pimpri Chinchwad, Pune",24000,900 sqft,Flat,Semi-Furnished,East,Garden/Park,2,1,Bachelors,From Feb '26
Pune,3,"Kundan Espacio, Kundan Espacio, Balewadi, Pune",55000,1505 sqft,Flat,Semi-Furnished,East,"Garden/Park, Main Road",3,2,Bachelors,Immediately
Pune,3,"Marquee 33 West Avenue, Marquee 33 West Avenue, Baner, Pune",60000,1800 sqft,Flat,Semi-Furnished,East,Main Road,3,2,Bachelors,Immediately
Pune,2,"Kumar Park Infinia, Kumar Park Infinia, Phursungi IT Park, SP Infocity, Pune",24000,750 sqft,Flat,Semi-Furnished,East,"Garden/Park, Pool, Main Road",2,2,Bachelors/Family,Immediately
Pune,3,"Kolte-Patil 24k Opula, Kolte-Patil 24k Opula, Kolte Patil, Pune",75000,1520 sqft,Flat,Semi-Furnished,East,Garden/Park,3,2,Family,From Feb '26
Pune,2,"Baner, Pune",30000,850 sqft,Flat,Semi-Furnished,West,Garden/Park,2,2,Bachelors/Family,Immediately
Pune,2,"Sunset Avenue, Sunset Avenue, Baner Gaon, Baner, Pune",38000,750 sqft,Flat,Unfurnished,,,2,1,Bachelors/Family,From Feb '26
Pune,3,"Sukhwani Empire Square, Sukhwani Empire Square, Chinchwad, Pimpri Chinchwad, Pune",42000,1060 sqft,Flat,Unfurnished,East,Main Road,2,3,Family,Immediately
Pune,3,"Kolte-Patil Ivy Villas, Wagholi Pune",35000,1380 sqft,Villa,Unfurnished,West,Main Road,3,2,Bachelors,Immediately
Pune,2,"Silver Oak, Silver Oak, Kalyani Nagar, Pune",55000,1310 sqft,Flat,Furnished,East,"Garden/Park, Pool, Main Road",2,2,Bachelors,Immediately
Pune,2,"Clover Acropolis, Clover Acropolis, Viman Nagar, Pune",55000,1000 sqft,Flat,Unfurnished,East,,2,2,Family,From Feb '26
Pune,1,"Yashoda Serenia, Yashoda Serenia, Hinjawadi Wakad Road, Pune",16500,514 sqft,Flat,Unfurnished,East,"Main Road, Pool, Garden/Park",1,2,Bachelors/Family,Immediately
Pune,3,"Pristine Pacific 1, Pristine Pacific 1, Ambegaon, Pune",23000,1125 sqft,Flat,Unfurnished,East,"Garden/Park, Main Road",3,2,Bachelors,Immediately
Pune,3,"Xrbia Hinjewadi, Xrbia Hinjewadi, Hinjawadi, Pune",13800,571 sqft,Flat,Unfurnished,East,"Garden/Park, Pool, Main Road",2,3,Bachelors,Immediately
Pune,3,"Canal Road, Pune",65000,1100 sqft,Flat,Unfurnished,West,Main Road,2,1,Bachelors,Immediately
Pune,3,"GK Roseland Residency, Pimple Saudagar, Pimpri Chinchwad Pune",38000,1800 sqft,Villa,Unfurnished,North - East,"Garden/Park, Pool, Main Road",3,3,Bachelors,Immediately
Pune,2,"Vilas Javdekar Yashwin Supernova, Vilas Javdekar Yashwin Supernova, Wakad, Pune",32000,850 sqft,Flat,Furnished,East,Garden/Park,2,1,Bachelors/Family,Immediately
Pune,1,"Magarpatta Heliconia, Magarpatta Heliconia, Phase 2 Magarpatta, Pune",27000,450 sqft,Flat,Furnished,East,"Garden/Park, Main Road",1,,Bachelors/Family,Immediately
Pune,3,"Unique K Shire, Unique K Shire, Punawale, Pimpri Chinchwad, Pune",36000,1067 sqft,Flat,Unfurnished,East,Main Road,3,3,Bachelors/Family,Immediately
Pune,3,"VTP Aethereus, VTP Aethereus, Mahalunge, Pune",33000,1011 sqft,Flat,Semi-Furnished,East,"Pool, Garden/Park, Main Road",3,3,Bachelors,Immediately
Pune,1,"Chidanand Society, Chidanand Society, Pashan Sus Road, Pune",21500,550 sqft,Flat,Semi-Furnished,East,Main Road,1,1,Family,From Feb '26
Pune,2,"Nyati Esteban I, Nyati Esteban I, Undri, Pune",30000,1024 sqft,Flat,Unfurnished,,"Garden/Park, Pool",2,1,Bachelors/Family,Immediately
Pune,2,"Pegasus Megapolis, Pegasus Megapolis, Phase 3 Hinjewadi Rajiv Gandhi Infotech Park, Pune",24000,900 sqft,Flat,Furnished,East,Garden/Park,2,2,Bachelors,Immediately
Pune,2,"Arti Apartment, Arti Apartment, Erandwane, Pune",40000,780 sqft,Flat,Furnished,East,Main Road,2,1,Bachelors,Immediately
Pune,2,"Prakrtii, Prakrtii, Laxmi Nagar Balewadi, Pune",29500,821 sqft,Flat,Unfurnished,East,Main Road,2,2,Bachelors/Family,Immediately
Pune,3,"Dorabjee Paradise, Mohammed Wadi Pune",55000,2850 sqft,Villa,Semi-Furnished,East,"Garden/Park, Main Road",4,2,Bachelors,Immediately
Pune,2,"Rohan Mithila, Rohan Mithila, Viman Nagar, Pune",55000,860 sqft,Flat,Furnished,East,"Pool, Garden/Park, Main Road",2,2,Bachelors,Immediately
Pune,2,"Rahul Arcus, Rahul Arcus, Baner, Pune",45000,1250 sqft,Flat,Furnished,East,"Garden/Park, Pool, Main Road",2,2,Bachelors,Immediately
Pune,4,"Marvel Simrose, Marvel Simrose, Koregaon Park, Pune",3 Lac,4500 sqft,Flat,Furnished,East,"Garden/Park, Main Road",4,2,Bachelors/Family,Immediately
Pune,4,"Mantra Mirari, Mantra Mirari, Mundhwa, Pune",45000,1370 sqft,Flat,Semi-Furnished,East,"Garden/Park, Main Road",3,2,Bachelors,Immediately
Pune,3,"Rahul Downtown, Rahul Downtown, Bapu Buwaji Nagar, Pune",30000,978 sqft,Flat,Semi-Furnished,East,"Garden/Park, Pool, Main Road",3,2,Bachelors,Immediately
Pune,3,"Supreme Palms, Supreme Palms, Balewadi, Pune",42000,1700 sqft,Flat,Semi-Furnished,East,Garden/Park,3,2,Family,Immediately
Pune,2,"Bramha Majestic, Bramha Majestic, Kondhwa, Pune",28000,900 sqft,Flat,Semi-Furnished,East,Main Road,2,2,Family,Immediately
Pune,2,"Vijayalaxmi Laxmisatyam Residensy, Vijayalaxmi Laxmisatyam Residensy, Siddartha Nagar Dhanori, Pune",28000,750 sqft,Flat,Furnished,East,"Garden/Park, Main Road",2,3,Bachelors/Family,Immediately
Pune,3,"Lodha Belmondo Ashbridge D E, Lodha Belmondo Ashbridge D E, Gahunje, Pune",85000,1450 sqft,Flat,Furnished,East,"Garden/Park, Main Road",4,1,Bachelors/Family,Immediately
Pune,2,"Ashoka Triplex Apartment, Ashoka Triplex Apartment, Nilanjali Society, Pune",1.2 Lac,1100 sqft,Flat,Unfurnished,North,Garden/Park,2,,Bachelors/Family,Immediately
Pune,3,"Nyati Esteban I, Nyati Esteban I, Hills and Dales, Pune",37000,1250 sqft,Flat,Unfurnished,East,Garden/Park,3,1,Bachelors/Family,Immediately
Pune,3,"Shree Sonigara Signature Park, Shree Sonigara Signature Park, Wakad, Pune",43000,1000 sqft,Flat,Furnished,East,"Garden/Park, Pool, Main Road",3,2,Bachelors/Family,Immediately
Pune,3,"Mantra Montana, Mantra Montana, Siddartha Nagar Dhanori, Pune",33000,1100 sqft,Flat,Unfurnished,East,Garden/Park,3,2,Bachelors,Immediately
Pune,2,"51 Balewadi Residency, 51 Balewadi Residency, Balewadi Gaon, Balewadi, Pune",34000,730 sqft,Flat,Unfurnished,East,Main Road,2,2,Family,Immediately
Pune,3,"Krishna Amarillo, Krishna Amarillo, Hinjawadi, Pune",30000,850 sqft,Flat,Semi-Furnished,East,"Pool, Garden/Park, Main Road",2,2,Bachelors/Family,Immediately
Pune,2,"Hinjewadi IT Park, Hinjewadi IT Park, Hinjewadi Rajiv Gandhi Infotech Park, Hinjawadi, Pune",40000,1100 sqft,Flat,Furnished,North - East,"Main Road, Garden/Park, Pool",2,2,Bachelors,Immediately
Pune,2,"Vilas Javdekar Yashwin Encore, Vilas Javdekar Yashwin Encore, Wakad, Pune",27000,750 sqft,Flat,Unfurnished,East,Main Road,2,1,Bachelors,Immediately
Pune,2,"Menlo Homes Hinjewadi, Menlo Homes Hinjewadi, Hinjawadi Village, Pune",28000,544 sqft,Flat,Semi-Furnished,East,"Garden/Park, Pool",2,2,Bachelors,Immediately
Pune,2,"Dreams Elina, Dreams Elina, Handewadi Road, Pune",29000,1239 sqft,Flat,Furnished,North - East,,2,2,Bachelors/Family,Immediately
Pune,3,"Nexus Kinaara, Nexus Kinaara, Chikhali, Pune",19000,930 sqft,Flat,Unfurnished,,,3,3,Bachelors/Family,Immediately
Pune,2,"Ira, Ira, Undri, Pune",19000,821 sqft,Flat,Semi-Furnished,,,2,1,Bachelors/Family,Immediately
Pune,3,"Yash Grecia, Yash Grecia, Dhanori, Pune",27000,1150 sqft,Flat,Semi-Furnished,,,3,2,Bachelors/Family,Immediately
Pune,2,"Baramati, Pune",12000,1000 sqft,Flat,Semi-Furnished,,,1,,Bachelors/Family,Immediately
Pune,2,"Anandtara Whitefield Residences, Anandtara Whitefield Residences, Keshav Nagar Mundhwa, Pune",30000,985 sqft,Flat,Furnished,East,"Main Road, Garden/Park",2,2,Bachelors,Immediately
Pune,3,"Nanded City, Nanded City, Sinhgad Road, Pune",30000,1558 sqft,Flat,Unfurnished,East,"Pool, Garden/Park, Main Road",3,1,Bachelors,Immediately
Pune,2,"Karvenagar, Pune",26950,715 sqft,Flat,Semi-Furnished,East,Main Road,2,1,Bachelors,Immediately
Pune,2,"Hari Ganga, Hari Ganga, Vishrantwadi, Airport Road, Pune",38000,1100 sqft,Flat,Semi-Furnished,East,"Garden/Park, Pool",2,2,Bachelors,Immediately
Pune,2,"Atul Westernhills, Atul Westernhills, Baner, Pune",38000,850 sqft,Flat,Furnished,East,Garden/Park,2,2,Bachelors,Immediately
Pune,2,"12th Avenue, 12th Avenue, Tathawade Pimpri Chinchwad, Pune",28000,705 sqft,Flat,Semi-Furnished,West,Main Road,2,1,Bachelors,Immediately
Pune,2,"Godrej 24, Godrej 24, Phase 1 Hinjewadi Rajiv Gandhi Infotech Park, Pune",35000,700 sqft,Flat,Furnished,,,2,2,Bachelors/Family,Immediately
Pune,2,"Nyati Ebony, Nyati Ebony, Undri, Pune",25000,942 sqft,Flat,Furnished,,"Garden/Park, Main Road",2,2,Bachelors/Family,Immediately
Pune,3,"VTP Beaumonde Building T3, VTP Beaumonde Building T3, Manjri, Manjri Budruk, Pune",35000,1093 sqft,Flat,Semi-Furnished,East,Main Road,3,1,Bachelors,Immediately
Pune,2,"BG Eden Garden, BG Eden Garden, Tathawade Pimpri Chinchwad, Pune",26000,851 sqft,Flat,Unfurnished,North,Garden/Park,2,2,Bachelors,From Feb '26
Pune,2,"Sancheti Eves Garden, Sancheti Eves Garden, Keshav Nagar Mundhwa, Pune",35000,776 sqft,Flat,Furnished,East,Garden/Park,2,1,Bachelors/Family,Immediately
Pune,2,"VTP Belair E And F Building, VTP Belair E And F Building, Mahalunge, Pune",32000,750 sqft,Flat,Unfurnished,,,1,1,Bachelors/Family,Immediately
Pune,1,"Empire Estate, Empire Estate, Chinchwad, Pimpri Chinchwad, Pune",22500,600 sqft,Flat,Furnished,West,"Garden/Park, Main Road",2,1,Bachelors,Immediately
Pune,1,"Oxy Galaxy, Oxy Galaxy, Wagholi, Pune",13000,547 sqft,Flat,Furnished,East,"Garden/Park, Main Road",2,2,Bachelors/Family,Immediately
Pune,3,"Magarpatta Riverview City Falcon Towers, Magarpatta Riverview City Falcon Towers, Loni Kalbhor, Pune",22450,1350 sqft,Flat,Semi-Furnished,East,Garden/Park,2,2,Bachelors,Immediately
Pune,2,"Gulmohar Gardens, Gulmohar Gardens, Koregaon Park, Pune",45000,900 sqft,Flat,Semi-Furnished,North,Main Road,2,1,Bachelors,Immediately
Pune,3,"Gera Trinity Towers, Gera Trinity Towers, Kharadi, Pune",90000,1700 sqft,Flat,Furnished,North - East,"Pool, Garden/Park, Main Road",3,2,Bachelors,Immediately
Pune,1,"Kothrud, Pune",16000,500 sqft,Flat,Semi-Furnished,East,Main Road,1,,Bachelors,Immediately
Pune,2,"Paranjape Crystal Garden, Paranjape Crystal Garden, Pan Card Club Road, Pune",30000,1050 sqft,Flat,Unfurnished,North - East,Main Road,2,1,Bachelors,Immediately
Pune,2,"Polite Panorama, Polite Panorama, Dighi, Pune",25000,780 sqft,Flat,Furnished,East,Garden/Park,2,,Bachelors/Family,Immediately
Pune,1,"Kalpataru Exquisite, Kalpataru Exquisite, Wakad, Pune",30000,750 sqft,Flat,Furnished,East,Main Road,2,2,Family,Immediately
Pune,3,"Unique Youtopia, Unique Youtopia, Kharadi, Pune",50000,1100 sqft,Flat,Furnished,East,Garden/Park,3,2,Bachelors,Immediately
Pune,2,"Amrut Ganga, Amrut Ganga, Sinhgad Road, Pune",35000,1010 sqft,Flat,Semi-Furnished,North,Main Road,2,2,Bachelors/Family,Immediately
Pune,1,"Lokpriya Nagari, Lokpriya Nagari, Vishrantwadi, Airport Road, Pune",20000,650 sqft,Flat,Semi-Furnished,East,Garden/Park,1,1,Bachelors,Immediately
Pune,3,"Rohan Abhilasha, Rohan Abhilasha, Wagholi, Pune",45000,1500 sqft,Flat,Semi-Furnished,,,3,3,Bachelors/Family,Immediately
Pune,2,"Nyati Elan, Nyati Elan, Wagholi, Pune",24000,790 sqft,Flat,Semi-Furnished,,,2,1,Bachelors,Immediately
Pune,2,"Lohegaon, Pune",14000,870 sqft,Flat,Semi-Furnished,West,Main Road,2,2,Bachelors,Immediately
Pune,2,"Srinath Megapolis Symphony Phase I, Srinath Megapolis Symphony Phase I, Phase 3 Hinjewadi Rajiv Gandhi Infotech Park, Pune",35000,700 sqft,Flat,Furnished,North,"Pool, Garden/Park, Main Road",2,1,Bachelors,Immediately
Pune,1,"Marunji Road, Pune",11000,550 sqft,Flat,Unfurnished,East,,,1,Bachelors,Immediately
Pune,3,"VTP Aethereus, VTP Aethereus, Mahalunge, Pune",35000,1100 sqft,Flat,Unfurnished,,,3,,Bachelors/Family,Immediately
Pune,3,"Laburnum Park, Laburnum Park, Magarpatta, Pune",60000,1850 sqft,Flat,Unfurnished,East,"Garden/Park, Main Road",3,1,Bachelors,Immediately
Pune,2,"Vighnaharta Life Canvas, Vighnaharta Life Canvas, Mamurdi, Dehu Road, Pune",15000,636 sqft,Flat,Unfurnished,East,"Garden/Park, Pool, Main Road",2,2,Bachelors,Immediately
Pune,2,"Shree Hans Nagar, Shree Hans Nagar, Gokul Nagar Dhanori, Pune",17000,890 sqft,Flat,Semi-Furnished,West,"Garden/Park, Main Road",2,2,Bachelors,Immediately
Pune,2,"Gobind Shree Ganesh Graceland, Gobind Shree Ganesh Graceland, Rahatani, Pune",34000,780 sqft,Flat,Semi-Furnished,East,"Garden/Park, Main Road",2,2,Bachelors,Immediately
Pune,2,"Kohinoor Coral, Kohinoor Coral, Hinjawadi, Pune",25000,616 sqft,Flat,Semi-Furnished,East,"Garden/Park, Pool, Main Road",2,1,Bachelors,Immediately
Pune,2,"Shankaranad CHS, Shankaranad CHS, Sinhgad Road, Pune",16000,750 sqft,Flat,Semi-Furnished,East,,2,,Family,Immediately
Pune,2,"SKYi Star Towers, SKYi Star Towers, Bhukum, Pune",23000,550 sqft,Flat,Furnished,East,"Garden/Park, Main Road",2,1,Bachelors,Immediately
Pune,3,"Gulmohar City, Gulmohar City, Kharadi, Pune",50000,1680 sqft,Flat,Semi-Furnished,East,"Garden/Park, Pool, Main Road",3,4,Bachelors/Family,Immediately
Pune,2,"Kohinoor Tinsel County, Kohinoor Tinsel County, Phase 3 Hinjewadi Rajiv Gandhi Infotech Park, Pune",26500,736 sqft,Flat,Furnished,East,"Garden/Park, Pool, Main Road",2,2,Bachelors,Immediately
Pune,4,"Ace Sai Dwarka Paradise, Kiwale, Dehu Road Pune",43000,2230 sqft,Villa,Semi-Furnished,East,"Garden/Park, Pool, Main Road",4,3,Bachelors,Immediately
Pune,1,"Sant Tukaram Nagar Pimpri Colony, Pune",20000,440 sqft,Flat,Semi-Furnished,South - East,Main Road,1,,Bachelors/Family,Immediately
Pune,2,"Balboa Avenue, Balboa Avenue, Ravet, Pimpri Chinchwad, Pune",25000,750 sqft,Flat,Furnished,East,"Garden/Park, Pool, Main Road",2,2,Bachelors,Immediately
Pune,2,"MP Residency, MP Residency, Hinjawadi, Pune",20000,896 sqft,Flat,Semi-Furnished,East,"Garden/Park, Main Road",2,2,Bachelors,Immediately
Pune,3,"Jhala Manjri Green Annexe, Jhala Manjri Green Annexe, Manjri, Manjri Budruk, Pune",25000,865 sqft,Flat,Unfurnished,East,"Garden/Park, Pool, Main Road",3,2,Bachelors/Family,Immediately
Pune,2,"Paranjape The Highland, Paranjape The Highland, Paud Road, Pune",22000,670 sqft,Flat,Semi-Furnished,North,"Pool, Main Road",2,2,Bachelors,Immediately
